{
  "schema": "dhct.expedition-transfer@1",
  "expeditionId": "test-drag-drop",
  "revision": 18,
  "authority": "web",
  "phase": "prepared",
  "characters": [
    {
      "characterId": "foundry-character-LnbQjzGv9YeIvP4W",
      "name": "test2",
      "foundryActorUuid": "Actor.LnbQjzGv9YeIvP4W",
      "backpack": {
        "containerId": "foundry-backpack-LnbQjzGv9YeIvP4W",
        "capacity": {
          "slots": 8
        },
        "storageProfile": {
          "accepts": [],
          "mergeStacks": true
        },
        "materialStorage": {
          "accepts": [],
          "stackLimit": 1,
          "mergeStacks": false
        },
        "contents": [
          {
            "entryId": "srd-2-0-consumable-core-15-morphing-clay-1",
            "sourceId": "srd-2.0.consumable.core-15-morphing-clay",
            "quantity": 1,
            "foundryItemUuid": "Compendium.daggerheart-campaign-toolkit.dh-consumables.Item.tZhbYT5sFV32O2cS",
            "display": {
              "name": "Argile métamorphe",
              "img": "icons/commodities/stone/ore-chunk-brown.webp",
              "type": "consumable"
            }
          }
        ]
      },
      "materialKnowledge": {
        "materials": {}
      },
      "materialKnowledgeCoverage": "captured"
    },
    {
      "characterId": "foundry-character-2x0apGuiZlElFoVT",
      "name": "Témoin",
      "foundryActorUuid": "Actor.2x0apGuiZlElFoVT",
      "backpack": {
        "containerId": "foundry-backpack-2x0apGuiZlElFoVT",
        "capacity": {
          "slots": 8
        },
        "storageProfile": {
          "accepts": [],
          "mergeStacks": true
        },
        "materialStorage": {
          "accepts": [],
          "stackLimit": 1,
          "mergeStacks": false
        },
        "contents": []
      },
      "materialKnowledge": {
        "materials": {}
      },
      "materialKnowledgeCoverage": "captured"
    },
    {
      "characterId": "foundry-character-eAj8QUyotLzQk8rX",
      "name": "00arti",
      "foundryActorUuid": "Actor.eAj8QUyotLzQk8rX",
      "backpack": {
        "containerId": "foundry-backpack-eAj8QUyotLzQk8rX",
        "capacity": {
          "slots": 8
        },
        "storageProfile": {
          "accepts": [],
          "mergeStacks": true
        },
        "materialStorage": {
          "accepts": [],
          "stackLimit": 1,
          "mergeStacks": false
        },
        "contents": []
      },
      "materialKnowledge": {
        "materials": {
          "mh.vespoid.wing": {
            "discoveredProperties": {
              "light": {
                "discoveredAt": 1791363099048,
                "source": {
                  "type": "fob-research",
                  "queueEntryId": "1abcca85-64e7-484e-a2d6-b0e14bd3f572",
                  "fobTurn": 13
                }
              },
              "resonant": {
                "discoveredAt": 1791793733158,
                "source": {
                  "type": "gm-research-status"
                }
              },
              "flexible": {
                "discoveredAt": 1791793735126,
                "source": {
                  "type": "gm-research-status"
                }
              },
              "conductive": {
                "discoveredAt": 1791966318021,
                "source": {
                  "type": "gm-research-status"
                }
              }
            },
            "propertyStatuses": {}
          },
          "mh.vespoid.gland": {
            "discoveredProperties": {
              "conductive": {
                "discoveredAt": 1791292175727,
                "source": {
                  "type": "gm-research-status"
                }
              },
              "electric": {
                "discoveredAt": 1791292180065,
                "source": {
                  "type": "gm-research-status"
                }
              }
            },
            "propertyStatuses": {}
          },
          "mh.basic.eau-de-source": {
            "discoveredProperties": {
              "resonant": {
                "discoveredAt": 1791793688407,
                "source": {
                  "type": "gm-research-status"
                }
              },
              "conductive": {
                "discoveredAt": 1791815459641,
                "source": {
                  "type": "gm-research-status"
                }
              },
              "light": {
                "discoveredAt": 1791815460653,
                "source": {
                  "type": "gm-research-status"
                }
              }
            },
            "propertyStatuses": {}
          },
          "mh.basic.filament-insecte": {
            "discoveredProperties": {
              "resonant": {
                "discoveredAt": 1791793699422,
                "source": {
                  "type": "gm-research-status"
                }
              },
              "flexible": {
                "discoveredAt": 1791899532051,
                "source": {
                  "type": "gm-research-status"
                }
              },
              "light": {
                "discoveredAt": 1791899533680,
                "source": {
                  "type": "gm-research-status"
                }
              }
            },
            "propertyStatuses": {}
          },
          "mh.basic.racine-amere": {
            "discoveredProperties": {
              "rigid": {
                "discoveredAt": 1791809095915,
                "source": {
                  "type": "gm-research-status"
                }
              },
              "reinforcing": {
                "discoveredAt": 1791809097067,
                "source": {
                  "type": "gm-research-status"
                }
              },
              "dense": {
                "discoveredAt": 1791809099027,
                "source": {
                  "type": "gm-research-status"
                }
              }
            },
            "propertyStatuses": {}
          },
          "mh.basic.herbes-communes": {
            "discoveredProperties": {
              "light": {
                "discoveredAt": 1791809144205,
                "source": {
                  "type": "gm-research-status"
                }
              },
              "resonant": {
                "discoveredAt": 1791809145789,
                "source": {
                  "type": "gm-research-status"
                }
              },
              "flexible": {
                "discoveredAt": 1791815493717,
                "source": {
                  "type": "gm-research-status"
                }
              }
            },
            "propertyStatuses": {}
          },
          "mh.basic.spores-luminescentes": {
            "discoveredProperties": {
              "resonant": {
                "discoveredAt": 1791818834599,
                "source": {
                  "type": "gm-research-status"
                }
              },
              "light": {
                "discoveredAt": 1791818837806,
                "source": {
                  "type": "gm-research-status"
                }
              },
              "conductive": {
                "discoveredAt": 1791818840206,
                "source": {
                  "type": "gm-research-status"
                }
              }
            },
            "propertyStatuses": {}
          },
          "mh.tetsucabra.hide": {
            "discoveredProperties": {
              "flexible": {
                "discoveredAt": 1791818852646,
                "source": {
                  "type": "gm-research-status"
                }
              },
              "dense": {
                "discoveredAt": 1791818856014,
                "source": {
                  "type": "gm-research-status"
                }
              },
              "reinforcing": {
                "discoveredAt": 1791818858135,
                "source": {
                  "type": "gm-research-status"
                }
              }
            },
            "propertyStatuses": {}
          },
          "mh.basic.argile-fine": {
            "discoveredProperties": {
              "dense": {
                "discoveredAt": 1791899575713,
                "source": {
                  "type": "gm-research-status"
                }
              },
              "reinforcing": {
                "discoveredAt": 1791899578769,
                "source": {
                  "type": "gm-research-status"
                }
              },
              "rigid": {
                "discoveredAt": 1791899581834,
                "source": {
                  "type": "gm-research-status"
                }
              }
            },
            "propertyStatuses": {}
          },
          "mh.basic.sève-claire": {
            "discoveredProperties": {
              "resonant": {
                "discoveredAt": 1791899615347,
                "source": {
                  "type": "gm-research-status"
                }
              },
              "reinforcing": {
                "discoveredAt": 1791899618408,
                "source": {
                  "type": "gm-research-status"
                }
              },
              "flexible": {
                "discoveredAt": 1791899621560,
                "source": {
                  "type": "gm-research-status"
                }
              }
            },
            "propertyStatuses": {}
          }
        }
      },
      "materialKnowledgeCoverage": "captured"
    },
    {
      "characterId": "foundry-character-yCIKjFUNDPGcnaj7",
      "name": "Porteur",
      "foundryActorUuid": "Actor.yCIKjFUNDPGcnaj7",
      "backpack": {
        "containerId": "foundry-backpack-yCIKjFUNDPGcnaj7",
        "capacity": {
          "slots": 8
        },
        "storageProfile": {
          "accepts": [],
          "mergeStacks": true
        },
        "materialStorage": {